{
  "question": "În ce condiții se returnează taxa de înscriere?",
  "answer": "Taxa de înscriere **nu se returnează**. Aceasta este informația specificată în secțiunea referitoare la taxa de înscriere din întrebările frecvente. \n\nDacă ai nevoie de mai multe detalii sau informații suplimentare, te încurajez să consulți pagina oficială a USM pentru actualizări și informații complete: [Întrebări frecvente -- Admitere 2024](https://admitere.usm.md/?page_id=1925).",
  "contexts": [
    "Taxe Admitere 2024 - Master\n\nTaxe de studii - Admiterea 2024 (Master)\n========================================\n\nBiologie și Geoștiințe\n----------------------\n\n| Nr. | Cod domeniu |         Program de studiu          | Forma | Taxa (lei) |\n|-----|-------------|------------------------------------|-------|------------|\n| 1   | 081         | Design de landşaft şi spaţii verzi | zi    | 7.500      |\n| 2   | 052         | Managementul mediului              | zi    | 7.500      |\n| 3   | 051         | Biologie moleculară                | zi    | 7.500      |\n| 4   | 051         | Științe biologice aplicate         | zi    | 7.500      |\n\nChimie și Tehnologie Chimică\n----------------------------\n\n| Nr. | Cod domeniu |                               Program de studiu                               | Forma | Taxa (lei) |\n|-----|-------------|-------------------------------------------------------------------------------|-------|------------|\n| 1   | 071         | Tehnologii moderne în industria cosmetică, farmaceutică și protecția mediului | zi    | 7.700      |\n| 2   | 050         | Materiale avansate în chimie şi biofarmaceutică                               | zi    | 7.700      |\n\nDrept\n-----\n\n| Nr. | Cod domeniu |                  Program de studiu                   | Forma  |   Taxa (lei)    |\n|-----|-------------|------------------------------------------------------|--------|-----------------|\n| 1   | 042         | Proces penal şi criminalistică                       | zi     | 15.000          |\n| 2   | 042         | Proceduri judiciare civile                           | zi     | 15.000          |\n| 3   | 042         | Drept penal                                          | zi     | 15.000          |\n| 4   | 042         | Drept civil                                          | zi     | 15.000          |\n| 5   | 042         | Drept internaţional                                  | zi     | 15.000          |\n| 6   | 042         | Dreptul relaţiilor de muncă şi comerciale în afaceri | zi     | 15.000          |\n| 7   | 042         | Drept public și guvernare electronică                | zi     | 15.000          |\n| 8   | 042         | Drept fiscal și vamal                                | zi     | 15.000          |\n| 9   | 042         | Drept fiscal și activitate vamală                    | zi     | 15.000          |\n| 10  | 042         | Drepturile omului                                    | zi     | 15.000          |\n| 11  | 042         | Științe penale aplicative                            | zi     | 15.000          |\n| 12  | 040         | Drept public                                         | zi, fr | 15.000 / 13.000 |\n| 13  | 042         | Anticorupție                                         | zi, fr | 15.000 / 13.000 |\n\nFizică și Inginerie\n-------------------\n\n| Nr. | Cod domeniu |           Program de studiu           | Forma | Taxa (lei) |\n|-----|-------------|---------------------------------------|-------|------------|\n| 1   | 053         | Fizică                                | zi    | 7.700      |\n| 2   | 061         | Tehnologii informaţionale în modelare | zi    | 12.000     |\n\nIstorie și Filosofie\n--------------------\n\n| Nr. | Cod domeniu |               Program de studiu                | Forma | Taxa (lei) |\n|-----|-------------|------------------------------------------------|-------|------------|\n| 1   | 022         | Managementul patrimoniului cultural            | zi    | 7.900      |\n| 2   | 022         | Istoria și cultura religiilor                  | zi    | 7.900      |\n| 3   | 022         | Stat și societate din perspectivă istorică     | zi    | 7.900      |\n| 4   | 022         | Filosofie, antropologie și management cultural | zi    | 7.900      |\n| 5   | 022         | Filosofii contemporane                         | zi    | 7.900      |\n\nJurnalism și Științe ale Comunicării\n------------------------------------\n\n| Nr. | Cod domeniu |         Program de studiu          | Forma | Taxa (lei) |\n|-----|-------------|------------------------------------|-------|------------|\n| 1   | 032         | Relaţii publice şi publicitate     | zi    | 10.000     |\n| 2   | 032         | Producție video și media promoting | zi    | 9.000      | [Source]{https://admitere.usm.md/?page_id=3741)",
    "Întrebări frecvente -- Admitere 2024 [Skip to content](https://admitere.usm.md/?page_id=1925#page-content)  \n[](https://admitere.usm.md/)[](https://admitere.usm.md/)\n\n* [Oferta 2024](http://admitere.usm.md/)\n  * [Licenta](https://admitere.usm.md/?page_id=98)\n  * [Master](https://admitere.usm.md/?page_id=94)\n  * [Întrebări frecvente](https://admitere.usm.md/?page_id=1925)\n  * [Programe de motivare](https://admitere.usm.md/?page_id=2395)\n  * [Broșuri](https://admitere.usm.md/?page_id=41)\n  * [Taxe](https://admitere.usm.md/?page_id=4209)\n\n* [Calendarul admiterii](https://admitere.usm.md/?page_id=3906)\n\n* [Acte](http://admitere.usm.md/)\n  * [Regulamente](https://admitere.usm.md/?page_id=50)\n  * [Acte necesare admitere](http://admitere.usm.md/)\n    * [Acte necesare la admitere ciclul I](https://admitere.usm.md/?page_id=562)\n    * [Acte necesare la admitere ciclul II](https://admitere.usm.md/?page_id=565)\n  * [Plan de admitere](https://admitere.usm.md/?page_id=1925#)\n    * [Plan admitere Licenţă cu frecvență](http://admitere.usm.md/wp-content/uploads/Plan-inmatriculare_Licenta-2.pdf)\n    * [Plan admitere Licenţă cu frecvență redusă](http://admitere.usm.md/wp-content/uploads/Plan-inmatriculare_Licenta_frec.-redusa-1.pdf)\n    * [Plan admitere Master cu frecvență](http://admitere.usm.md/wp-content/uploads/Plan-inmatriculare_Master-2.pdf)\n    * [Plan admitere Master cu frecvență redusă](http://admitere.usm.md/wp-content/uploads/Plan-inmatriculare_master.frec_.redusa.pdf)\n    * [Plan admitere pentru studenți străini](http://admitere.usm.md/wp-content/uploads/plan-inmatr.-cetateni-straini-1.pdf)\n  * [Tuition fees](https://admitere.usm.md/?page_id=1476)\n  * [Taxe de studii](http://admitere.usm.md/)\n    * [Taxele de studii, Ciclul I studii superioare de licenţă](https://admitere.usm.md/?page_id=3740)\n    * [Taxele de studii, Ciclul II studii superioare de masterat](https://admitere.usm.md/?page_id=3741)\n\n* [Comisia de admitere](https://admitere.usm.md/?page_id=1445)\n\n* [Rezultate](https://admitere.usm.md/?page_id=56)\n  * [Turul I: Anunţarea rezultatelor finale](https://admitere.usm.md/?page_id=2682)\n  * [Turul II: Anunţarea rezultatelor finale](https://admitere.usm.md/?page_id=2778)\n\n* [Centrul de Ghidare în Carieră](https://cgc.usm.md/)\n\n* [Ro:](https://admitere.usm.md/?page_id=1925# \"Română\")\n  * [Română](https://admitere.usm.md/?page_id=1925&lang=ro \"Română\")\n  * [English](https://admitere.usm.md/?page_id=1925&lang=en \"English\")\n  * [Русский](https://admitere.usm.md/?page_id=1925&lang=ru \"Русский\")\n[](https://admitere.usm.md/?page_id=1925#)\n\nÎntrebări frecvente\n===================\n\n<br />\n\n**Când începe concursul de admitere la USM?**\n\nÎnscrierea candidaților la concursul de admitere se va realiza prin intermediul sistemului informațional **eAdmitere** , accesând pagina web **eadmitere.gov.md** Perioada exactă a admiterii va fi stabilită de Ministerul Educației și Cercetării și va fi anunțată ulterior. Vă recomandăm să urmăriți pagina oficială a USM pentru informații actualizate.\n\n**Unde pot obține informații despre oferta educațională a facultăților?**\n\n**oferta educațională licență:** **[Specialitati -- Admitere 2025 (usm.md)](https://admitere.usm.md/?page_id=98)**\n\n**oferta educațională master: [Specialitati -- Admitere 2025 (usm.md)](https://admitere.usm.md/?page_id=94)**\n\n**Pot aplica on-line la programele de licență a USM?**\n\nDa, poți aplica online la programele de licență ale USM prin intermediul sistemului informațional eAdmitere, accesând pagina web [eadmitere.gov.md](http://eadmitere.gov.md/). Înscrierea și depunerea actelor se realizează exclusiv online, conform procedurilor stabilite. Vă recomandăm să consultați calendarul admiterii pentru termenele și etapele procesului de admitere\n\n**Unde pot depune dosarul?**\n\nDosarul de admitere se depune exclusiv online, prin intermediul platformei eAdmitere, accesând eadmitere.gov.md. Toate documentele necesare trebuie încărcate în sistem conform instrucțiunilor disponibile pe platformă. Vă recomandăm să consultați calendarul admiterii pentru termenele și etapele procesului.\n\n**Pot să depun dosarul la mai multe programe de studii universitare de licență?**\n\nDa, poți opta pentru maxim 3 specialități/programe de studii în cadrul aceleiași sau a diferitor facultăți, depunând un singur dosar de înscriere. În cererea de înscriere la admitere vei specifica specialitățile/programele de studii solicitate și vei achita o singura taxă de înscriere.\n\n**Ce acte conține dosarul de înscriere?**\n\nDosarul de înscriere la concursul de admitere conține:\n\n**[Acte Licență](https://admitere.usm.md/?page_id=562)**\n\n**[Acte Master](https://admitere.usm.md/?page_id=565)**\n\n**Care sunt condițiile de admitere la facultăți?**\n\nConcursul de admitere pentru deţinătorii diplomelor de bacalaureat, diplomelor de studii medii de specialitate şi diplomelor de studii superioare/licenţă se va efectua în baza următoarei formule de concurs:\n\n**MC = 0,5 MEA+ 0,5 MAS,** unde:\n\n**MC** -- *media de concurs;*\n\n**MEA** -- *nota medie a examenelor de absolvire;*\n\n**MAS** -- *nota medie pentru anii studii.*\n\n**Este posibil să îmi depună altcineva dosarul de concurs?**\n\nDa. Înscrierea unui candidat poate fi făcută de către o altă persoană numai dacă aceasta prezintă o procură autentificată notarial, în care se precizează explicit și împuternicirea respectivei persoane pentru semnarea contractului în numele candidatului.\n\n**Pot fi admis la USM în baza diplomei de absolvire a colegiului?**\n\nDa, se permite admiterea în baza diplomei de colegiu.\n\n**Ce discipline voi studia în decursul anilor de studii la USM?**\n\nConsultați planurile de învățământ accesând fiecare facultate+specialitate:\n\n* **oferta educațională licență: [Specialitati -- Admitere 2025 (usm.md)](https://admitere.usm.md/?page_id=98)**\n\n* **oferta educațională master: ++[Specialitati -- Admitere 2025 (usm.md)](https://admitere.usm.md/?page_id=94)++**\n\n**Am fost admis(ă), ce trebuie să fac pentru confirmarea locului?**\n\nÎn cazul în care ai fost admis(ă) pe locuri finanțate de la bugetul de stat, trebuie să depui actele în original, conform datelor indicate în calendarul admiterii.\n\nÎn cazul în care ai fost admis(ă) pe locuri cu taxă trebuie să depui actele în original, să semnezi contractual de studii, să achiți taxa de școlarizare şi să prezinți bonul de plată (în original sau copie după aceasta) conform datelor prevăzute în contractul de studii și indicate în calendarul admiterii.\n\nÎn cazul nerespectării acestor condiții, în perioada de înmatriculare, **CANDIDATUL** va fi declarat **RESPINS**.\n\n**Care este cuantumul taxei de înscriere?**\n\nCuantumul taxei de înscriere nu a fost încă stabilit. Informațiile actualizate privind taxele și alte detalii legate de admitere vor fi publicate pe site-ul oficial al USM mai aproape de perioada admiterii. Vă recomandăm să verificați periodic platformele oficiale pentru ultimele noutăți.\n\n**Unde achit taxa de înscriere?**\n\nTaxa de înscriere se achită, în momentul depunerii dosarului de concurs, prin intermediul ****terminalelor de plată**** , [****a serviciului Mpay****](https://mpay.gov.md/Services/Service/USM01)\n\n**În ce condiții se returnează taxa de înscriere?**\n\nTaxa de înscriere **nu se returnează**.\n\n**Se acordă scutiri pentru taxa de înscriere la admitere?**\n\nTaxa de inscriere nu va fi perceput de la candidații care aplică la Academia Militar „Alexandru cel Bun\", Academia „Stefan cel Mare\" a MAI, tinerii rămași fară ocrotire printească și acei cu grad accentuat și sever de dizabilitate.\n\n**Care este cuantumul taxei de studii?**\n\nTaxa anuală de studii pentru candidații admiși în regim cu taxă în anul universitar 2025-2026 va fi stabilită și anunțată ulterior. Vă recomandăm să consultați periodic site-ul oficial al USM pentru actualizări.\n\n**Se acordă reduceri la taxa de studii?**\n\nDa. Pot fi acordate următoarele reduceri de taxe pentru **candidații orfani,** proveniți din centre de plasament sau cu situații sociale deosebite:\n\n* reducere la taxa de studii;\n\n* reducere la taxa de cămin;\n\n* abonament lunar pentru troleibuz -- gratuit\n\nCuantumul acestor reduceri, precum și criteriile de acordare a lor se decid de conducerea universității.\n\n**Pot plăti taxa de studii prin transfer bancar?** [Source]{https://admitere.usm.md/?page_id=1925)",
    "Litere\n------\n\n| Nr. | Cod domeniu |                           Program de studiu                            | Forma | Taxa (lei) |\n|-----|-------------|------------------------------------------------------------------------|-------|------------|\n| 1   | 023         | Traducere și interpretare de conferințe                                | zi    | 10.000     |\n| 2   | 023         | Comunicare multilingvă, management intercultural și limbaje de afaceri | zi    | 9.000      |\n| 3   | 023         | Studii de filologie română și strategii educaționale                   | zi    | 8.000      |\n| 4   | 023         | Limba și literatura rusă                                               | zi    | 8.000      |\n\nPsihologie și Științe ale Educației, Sociologie și Asistență Socială\n--------------------------------------------------------------------\n\n| Nr. | Cod domeniu |              Program de studiu              | Forma | Taxa (lei) |\n|-----|-------------|---------------------------------------------|-------|------------|\n| 1   | 031         | Psihologie clinică                          | zi    | 14.000     |\n| 2   | 031         | Psihologia muncii și organizațională        | zi    | 9.000      |\n| 3   | 031         | Psihologie judiciară                        | zi    | 9.000      |\n| 4   | 011         | Managementul educațional                    | zi    | 8.000      |\n| 5   | 011         | Consilierea pentru probleme de familie      | zi    | 8.000      |\n| 6   | 011         | Formarea formatorilor                       | zi    | 8.000      |\n| 7   | 011         | Managementul serviciilor sociale            | zi    | 8.000      |\n| 8   | 031         | Sondaje de opinie, marketing și publicitate | zi    | 8.000      |\n\nMatematică și Informatică\n-------------------------\n\n| Nr. | Cod domeniu |                           Program de studiu                            | Forma | Taxa (lei) |\n|-----|-------------|------------------------------------------------------------------------|-------|------------|\n| 1   | 054         | Structuri matematice și metode de soluționare a problemelor aplicative | zi    | 7.700      |\n| 2   | 061         | Informatică aplicată                                                   | zi    | 12.000     |\n| 3   | 061         | Inteligența artificială și știința datelor                             | zi    | 12.000     |\n| 4   | 011         | Performanță matematică și STEAM                                        | zi    | 8.000      |\n\nRelații Internaționale, Științe Politice și Administrative\n----------------------------------------------------------\n\n| Nr. | Cod domeniu |       Program de studiu        | Forma  |   Taxa (lei)    |\n|-----|-------------|--------------------------------|--------|-----------------|\n| 1   | 031         | Studii de Securitate Națională | zi     | 11.000          |\n| 2   | 040         | Politici și servicii publice   | zi     | 9.000           |\n| 3   | 031         | Studii diplomatice             | zi     | 10.000          |\n| 4   | 031         | Studii europene                | zi     | 10.000          |\n| 5   | 031         | Relații internaționale         | zi, fr | 11.000 / 10.000 |\n| 6   | 040         | Administrare publică           | zi, fr | 10.000 / 9.000  |\n\nȘtiințe Economice\n-----------------\n\n| Nr. | Cod domeniu |                 Program de studiu                 | Forma  |   Taxa (lei)    |\n|-----|-------------|---------------------------------------------------|--------|-----------------|\n| 1   | 041         | Administrarea afacerilor                          | zi     | 12.000          |\n| 2   | 041         | Administrare bancară                              | zi     | 12.000          |\n| 3   | 041         | Audit și expertiza financiară                     | zi     | 12.000          |\n| 4   | 041         | Gestiunea finanțelor și contabilitatea în afaceri | zi     | 12.000          |\n| 5   | 041         | Finanțe publice și fiscalitate                    | zi     | 12.000          |\n| 6   | 041         | Studii în marketing                               | zi     | 12.000          |\n| 7   | 101         | Management și marketing hotelier și turism        | zi     | 10.000          |\n| 8   | 041         | Managementul resurselor umane                     | zi     | 12.000          |\n| 9   | 041         | Management                                        | zi, fr | 12.000 / 10.000 |\n| 10  | 041         | Baze de date și tehnici actuariale                | zi     | 14.000          |\n| 11  | 041         | Contabilitatea întreprinderii                     | zi     | 12.000          |\n\nEducație Fizică și Sport\n------------------------\n\n| Nr. | Cod domeniu |                          Program de studiu                          | Forma | Taxa (lei) |\n|-----|-------------|---------------------------------------------------------------------|-------|------------|\n| 1   | 014         | Psihopedagogia educației fizice și a activităților extracurriculare | zi    | 9.000      |\n| 2   | 100         | Cercetare în științe ale sportului                                  | zi    | 9.000      |\n| 3   | 100         | Tehnologia antrenamentului sportiv (90/120 c)                       | zi    | 9.000      |\n| 4   | 100         | Management sportiv                                                  | zi    | 9.000      |\n| 5   | 100         | Fitness și nutriție                                                 | zi    | 9.000      |\n| 6   | 100         | Kinetoterapie și terapie manuală în recuperarea funcțională         | zi    | 14.000     |\n| 7   | 101         | Tehnologii și management în turism                                  | zi    | 10.000     |\n| 8   | 100         | Managementul securității persoanelor și a proprietății              | zi    | 11.000     |\n\nNote\n----\n\nPentru studenții cetățeni ai altor state taxa de studii constituie **1.800 Euro**, cu excepția cetățenilor României și Ucrainei, taxa pentru aceștia fiind similară celei achitate de cetățenii Republicii Moldova. [Source]{https://admitere.usm.md/?page_id=3741)",
    "Da, după încheierea contractului de studii poți plăti taxa de studii prin transfer la orice sucursală a băncii Victoriabank. Rechizitele bancare ale USM sunt stipulate în contractul de studii.\n\n**Cum procedez în cazul în care vreau să-mi retrag dosarul?**\n\nRetragerea dosarului se face gratuit și necondiționat la comisia de admitere.\n\n**Dacă mă decid să îmi retrag dosarul din concurs, poate face altcineva lucrul acesta?**\n\nDa. Retragerea dosarului se poate face de către o altă persoană numai dacă aceasta prezintă o procură autentificată notarial.\n\n**Care este media generală de admitere la studii superioare de licență/integrate**\n\nMedia generală de admitere la studii superioare de licență/integrate este condiționată de media candidatului și criteriile stabilite pentru fiecare domeniu de studiu. Pentru domeniul Științe ale Educației, media de admitere nu poate fi mai mică de 6,50, indiferent de sursa de finanțare și forma de învățământ.\n\n**Dacă am fost înmatriculat la studii cu finanțare de la bugetul de stat voi beneficia de această finanțare pe toată durata studiilor?**\n\nFinanțarea de la bugetul de stat este oferită pentru un an de studii. La sfârșitul fiecărui an universitar se realizează un concurs al notelor medii pentru repartizarea locurilor cu finanțare de la bugetul de stat. Astfel, în dependență de mediile respective, unii studenți ar putea în continuare să beneficieze de finanțare de la bugetul de stat, iar alții să treacă la studii contra taxă.\n\n**Dacă intru la taxă cum pot ocupa ulterior un loc bugetat?**\n\nPoți trece pe locuri finanțate de la bugetul de stat după primul an de studii, în funcție de media pe care o vei obține.\n\n**Dacă doresc loc în cămin, mai este necesară completarea unui formular suplimentar?**\n\nPentru a beneficia de cazare în cămin, trebuie să depuneți o cerere la decanatul facultății la care ați fost admis. Perioada și procedura exactă vor fi anunțate ulterior, însă, de regulă, acest proces are loc după 20 august.\n\n**Cine poate beneficia de loc gratuit de cazare în cămine?**\n\nCei care corespund criteriilor stabilite de către Senatul USM.\n\n**Pot beneficia de un loc de cămin încă din primul an de studii?**\n\nPuteți benificia în limita locurilor disponibile.\n\n**Pot să studiez în paralel la două programe de studii/specialități?**\n\nNu. Poți urma a doua programă de studii în paralel, doar după finalizarea cel puţin a unui an de studii la primul program cu condiția că ai o notă medie înaltă. Poți beneficia de finanțare de la bugetul de stat doar la unul dintre programe, dacă nu ai mai beneficiat până la moment de un loc bugetat. Programele de studii în paralel pot fi realizate doar în cadrul aceleași instituții de învățământ superior, dar nu neapărat în aceeași facultate.\n\n**Ce burse oferă USM?**\n\nÎn baza performanțelor academice și ținând cont de prioritățile de dezvoltare, USM acordă din mijloacele sale special trei tipuri de burse de studii:\n\nburse de excelență -- pentru studenții care au fost admiși la universitate în baza unor rezultate academice remarcabile, obținute la olimpiadele republicane, regionale şi internaționale, detalii puteți vedea [**aici.**](https://admitere.usm.md/?page_id=2395)\n\nburse nominale -- pentru studenții cu rezultate academice înalte, înmatriculați la studii cu taxă, detalii puteți vedea [**aici.**](https://admitere.usm.md/?page_id=2395)\n\nburse nominale pentru candidații la specialitățile pedagogice, detalii puteți vedea [**aici.**](https://admitere.usm.md/?page_id=2395)\n\nburse sociale -- pentru tinerii performanți, care au fost admiși la universitate în baza unor rezultate academice înalte, fac parte din anumite categorii social-vulnerabile, dar nu au fost înmatriculați la locurile prevăzute pentru categoria 15%.\n\n**Pot beneficia de bursă socială dacă am restanțe?**\n\nNu, bursa socială se acordă în conformitate cu criteriile stabilite de regulamentul instituției, iar existența restanțelor poate influența eligibilitatea. Vă recomandăm să consultați regulamentul de acordare a burselor sau să contactați secretariatul facultății pentru informații suplimentare.\n\n**Pot deveni profesor de liceu absolvind USM?**\n\nDa, dacă îți faci studiile la o specializare din domeniul științelor educației sau dacă alegi suplimentar modulul psihopedagogic opțional oferit GRATIUT de USM. Pentru a urma acest modul trebuie să completezi o cerere la decanatul facultății la care ai fost admis. În urma absolvirii acestui programului de studii suplimentat de modulul psihopedagogic vei obține dreptul de a exercita profesia de profesor de liceu.\n\n**Dragi absolvenți!**\n\nPentru orice întrebări, opinii, reclamații sau sugestii, ne puteți contacta prin e-mail la **[ghidare.cariera@usm.md](mailto:ghidare.cariera@usm.md)** , pe pagina noastră de Facebook sau la numărul de telefon: **+373 67 560 009**\n\n**[Руководство для выпускников школ из Приднестровья](http://admitere.usm.md/wp-content/uploads/%D0%A0%D1%83%D0%BA%D0%BE%D0%B2%D0%BE%D0%B4%D1%81%D1%82%D0%B2%D0%BE-%D0%B4%D0%BB%D1%8F-%D0%B2%D1%8B%D0%BF%D1%83%D1%81%D0%BA%D0%BD%D0%B8%D0%BA%D0%BE%D0%B2-%D1%88%D0%BA%D0%BE%D0%BB-%D0%B8%D0%B7-%D0%9F%D1%80%D0%B8%D0%B4%D0%BD%D0%B5%D1%81%D1%82%D1%80%D0%BE%D0%B2%D1%8C%D1%8F.pdf)**\n\n###### Adresa\n\n###### Facultăţi\n\n* [Facultatea de Biologie si Pedologie](https://usm.md/?page_id=489)\n\n* [Facultatea de Chimie şi Tehnologie Chimică](https://usm.md/?page_id=492)\n\n* [Facultatea de Drept](https://usm.md/?page_id=495)\n\n* [Facultatea de Jurnalism şi Ştiinţe ale Comunicării](https://usm.md/?page_id=505)\n\n* [Facultatea de Fizica si Inginerie](https://usm.md/?page_id=498)\n\n* [Facultatea de Istorie şi Filosofie](https://usm.md/?page_id=502)\n\n* [Facultatea de Matematică şi Informatică](https://usm.md/?page_id=515)\n\n* [Facultatea de Litere](https://usm.md/?page_id=511)\n\n* [Facultatea de Științe Economice](https://usm.md/?page_id=528)\n\n* [Facultatea Psihologie, Ştiinţe ale Educaţiei, Sociologie și Asistență Socială](https://usm.md/?page_id=518)\n\n* [Facultatea de Relaţii Internaţionale, Ştiinţe Politice şi Administrative](https://usm.md/?page_id=522)\n\n###### Contacte\n\n* +373 22 244 810\n\n* 9:00 - 17:00\n\n* [Universitatea de Stat din Moldova str. Alexei Mateevici 60, MD-2009](https://www.google.com/maps/place/Universitatea+de+Stat+din+Moldova/@47.018939,28.824491,18z/data=!4m5!3m4!1s0x0:0xd8e8b74ac8c3ef7b!8m2!3d47.0192025!4d28.8230857?hl=ro)\n\n* rector@usm.md  \nToleranță zero corupției\n\n* integritate@usm.md\n\n* [old.usm.md](https://old.usm.md/)  \n[Facebook](https://www.facebook.com/UniversitateaDeStatDinMoldova/) [Instagram](https://www.instagram.com/accounts/login/?next=/usm.md/) [Youtube](https://www.youtube.com/channel/UC3oFsXde0eZRaAqeX_6iBcg/videos)  \n**Universitatea de Stat din Moldova 2025 © All Rights Reserved\n​**  \nSecție Programare Web al USM ®  \nUniversitatea de Stat din Moldova folosește module cookie strict necesare și alte tehnologii similare pentru a opera acest website și pentru a oferi utilizatorilor o experiență personalizată. Pe lângă modulele cookie strict necesare, Universitatea de Stat din Moldova folosește module cookie opționale pentru a îmbunătăți și personaliza experiența utilizatorilor, pentru a analiza performanța website-ului.[Ok](https://admitere.usm.md/?page_id=1925#)  \n[](https://admitere.usm.md/)[](https://admitere.usm.md/)\n\n* [Oferta 2024](http://admitere.usm.md/)\n  * [Licenta](https://admitere.usm.md/?page_id=98)\n  * [Master](https://admitere.usm.md/?page_id=94)\n  * [Întrebări frecvente](https://admitere.usm.md/?page_id=1925)\n  * [Programe de motivare](https://admitere.usm.md/?page_id=2395)\n  * [Broșuri](https://admitere.usm.md/?page_id=41)\n  * [Taxe](https://admitere.usm.md/?page_id=4209)\n\n* [Calendarul admiterii](https://admitere.usm.md/?page_id=3906)\n\n* [Acte](http://admitere.usm.md/)\n  * [Regulamente](https://admitere.usm.md/?page_id=50)\n  * [Acte necesare admitere](http://admitere.usm.md/)\n    * [Acte necesare la admitere ciclul I](https://admitere.usm.md/?page_id=562)\n    * [Acte necesare la admitere ciclul II](https://admitere.usm.md/?page_id=565)\n  * [Plan de admitere](https://admitere.usm.md/?page_id=1925#)\n    * [Plan admitere Licenţă cu frecvență](http://admitere.usm.md/wp-content/uploads/Plan-inmatriculare_Licenta-2.pdf)\n    * [Plan admitere Licenţă cu frecvență redusă](http://admitere.usm.md/wp-content/uploads/Plan-inmatriculare_Licenta_frec.-redusa-1.pdf)\n    * [Plan admitere Master cu frecvență](http://admitere.usm.md/wp-content/uploads/Plan-inmatriculare_Master-2.pdf)\n    * [Plan admitere Master cu frecvență redusă](http://admitere.usm.md/wp-content/uploads/Plan-inmatriculare_master.frec_.redusa.pdf)\n    * [Plan admitere pentru studenți străini](http://admitere.usm.md/wp-content/uploads/plan-inmatr.-cetateni-straini-1.pdf)\n  * [Tuition fees](https://admitere.usm.md/?page_id=1476)\n  * [Taxe de studii](http://admitere.usm.md/)\n    * [Taxele de studii, Ciclul I studii superioare de licenţă](https://admitere.usm.md/?page_id=3740)\n    * [Taxele de studii, Ciclul II studii superioare de masterat](https://admitere.usm.md/?page_id=3741)\n\n* [Comisia de admitere](https://admitere.usm.md/?page_id=1445)\n\n* [Rezultate](https://admitere.usm.md/?page_id=56)\n  * [Turul I: Anunţarea rezultatelor finale](https://admitere.usm.md/?page_id=2682)\n  * [Turul II: Anunţarea rezultatelor finale](https://admitere.usm.md/?page_id=2778)\n\n* [Centrul de Ghidare în Carieră](https://cgc.usm.md/)\n\n* [Ro:](https://admitere.usm.md/?page_id=1925# \"Română\")\n  * [Română](https://admitere.usm.md/?page_id=1925&lang=ro \"Română\")\n  * [English](https://admitere.usm.md/?page_id=1925&lang=en \"English\")\n  * [Русский](https://admitere.usm.md/?page_id=1925&lang=ru \"Русский\")\n\nNotificări [Source]{https://admitere.usm.md/?page_id=1925)"
  ],
  "groundTruth": "În ce condiții se returnează taxa de înscriere?"
}