{
  "answer": "Înscrierea candidaților la concursul de admitere se va realiza prin intermediul sistemului informațional **eAdmitere**, accesând pagina web **eadmitere.gov.md**. Perioada exactă a admiterii va fi stabilită de Ministerul Educației și Cercetării și va fi anunțată ulterior. Vă recomandăm să urmăriți pagina oficială a USM pentru informații actualizate. \n\nPentru mai multe detalii, puteți verifica [întrebările frecvente](https://admitere.usm.md/?page_id=1925).",
  "contexts": [
    "* adeverința eliberată de organul teritorial de tutelă și curatelă, pentru copiii orfani și copiii rămași fără ocrotire părintească;\n\n* certificatele medicale corespunzătoare, care atestă gradul de dizabilitate al candidatului sau al părinților acestuia;\n\n* certificatul care confirmă că unul din părinții candidatului a participat la acțiunile militare pentru apărarea integrității și independenței Republicii Moldova sau în războiul din Afganistan ori la lichidarea consecințelor avariei de la Cernobîl, eliberat de organele abilitate; adeverință care confirmă participarea candidatului la operațiunile militare post-conflict cu caracter umanitar în Irak;\n\n* certificatul despre componența familiei și copiile certificatelor de naștere ale fraților/surorilor (pentru candidații care provin din familii cu trei și mai mulți copii);\n\n* confirmarea apartenenței la familii de romi;\n\n* recomandarea organului local de specialitate în domeniul învățământului sau adeverința de la locul de muncă al părinților -- cadre didactice pentru înscrierea la concursul de admitere la specialitățile din domeniul general de studiu *Ştiinţe ale educaţiei;*\n\n* după caz certificatul medical (pentru programele care necesită capacități/rezistență fizică)\n\n###### Adresa\n\n###### Facultăţi\n\n* [Facultatea de Biologie si Pedologie](https://usm.md/?page_id=489)\n\n* [Facultatea de Chimie şi Tehnologie Chimică](https://usm.md/?page_id=492)\n\n* [Facultatea de Drept](https://usm.md/?page_id=495)\n\n* [Facultatea de Jurnalism şi Ştiinţe ale Comunicării](https://usm.md/?page_id=505)\n\n* [Facultatea de Fizica si Inginerie](https://usm.md/?page_id=498)\n\n* [Facultatea de Istorie şi Filosofie](https://usm.md/?page_id=502)\n\n* [Facultatea de Matematică şi Informatică](https://usm.md/?page_id=515)\n\n* [Facultatea de Litere](https://usm.md/?page_id=511)\n\n* [Facultatea de Științe Economice](https://usm.md/?page_id=528)\n\n* [Facultatea Psihologie, Ştiinţe ale Educaţiei, Sociologie și Asistență Socială](https://usm.md/?page_id=518)\n\n* [Facultatea de Relaţii Internaţionale, Ştiinţe Politice şi Administrative](https://usm.md/?page_id=522)\n\n###### Contacte\n\n* +373 22 244 810\n\n* 9:00 - 17:00\n\n* [Universitatea de Stat din Moldova str. Alexei Mateevici 60, MD-2009](https://www.google.com/maps/place/Universitatea+de+Stat+din+Moldova/@47.018939,28.824491,18z/data=!4m5!3m4!1s0x0:0xd8e8b74ac8c3ef7b!8m2!3d47.0192025!4d28.8230857?hl=ro)\n\n* rector@usm.md  \nToleranță zero corupției\n\n* integritate@usm.md\n\n* [old.usm.md](https://old.usm.md)  \n[Facebook](https://www.facebook.com/UniversitateaDeStatDinMoldova/) [Instagram](https://www.instagram.com/accounts/login/?next=/usm.md/) [Youtube](https://www.youtube.com/channel/UC3oFsXde0eZRaAqeX_6iBcg/videos)  \n**Universitatea de Stat din Moldova 2025 © All Rights Reserved\n​**  \nSecție Programare Web al USM ®  \nUniversitatea de Stat din Moldova folosește module cookie strict necesare și alte tehnologii similare pentru a opera acest website și pentru a oferi utilizatorilor o experiență personalizată. Pe lângă modulele cookie strict necesare, Universitatea de Stat din Moldova folosește module cookie opționale pentru a îmbunătăți și personaliza experiența utilizatorilor, pentru a analiza performanța website-ului.Ok [Source]{https://admitere.usm.md/?page_id=562)",
    "Întrebări frecvente -- Admitere 2024 [Skip to content](https://admitere.usm.md/?page_id=1925#page-content)  \n[](https://admitere.usm.md/)[](https://admitere.usm.md/)\n\n* [Oferta 2024](http://admitere.usm.md/)\n  * [Licenta](https://admitere.usm.md/?page_id=98)\n  * [Master](https://admitere.usm.md/?page_id=94)\n  * [Întrebări frecvente](https://admitere.usm.md/?page_id=1925)\n  * [Programe de motivare](https://admitere.usm.md/?page_id=2395)\n  * [Broșuri](https://admitere.usm.md/?page_id=41)\n  * [Taxe](https://admitere.usm.md/?page_id=4209)\n\n* [Calendarul admiterii](https://admitere.usm.md/?page_id=3906)\n\n* [Acte](http://admitere.usm.md/)\n  * [Regulamente](https://admitere.usm.md/?page_id=50)\n  * [Acte necesare admitere](http://admitere.usm.md/)\n    * [Acte necesare la admitere ciclul I](https://admitere.usm.md/?page_id=562)\n    * [Acte necesare la admitere ciclul II](https://admitere.usm.md/?page_id=565)\n  * [Plan de admitere](https://admitere.usm.md/?page_id=1925#)\n    * [Plan admitere Licenţă cu frecvență](http://admitere.usm.md/wp-content/uploads/Plan-inmatriculare_Licenta-2.pdf)\n    * [Plan admitere Licenţă cu frecvență redusă](http://admitere.usm.md/wp-content/uploads/Plan-inmatriculare_Licenta_frec.-redusa-1.pdf)\n    * [Plan admitere Master cu frecvență](http://admitere.usm.md/wp-content/uploads/Plan-inmatriculare_Master-2.pdf)\n    * [Plan admitere Master cu frecvență redusă](http://admitere.usm.md/wp-content/uploads/Plan-inmatriculare_master.frec_.redusa.pdf)\n    * [Plan admitere pentru studenți străini](http://admitere.usm.md/wp-content/uploads/plan-inmatr.-cetateni-straini-1.pdf)\n  * [Tuition fees](https://admitere.usm.md/?page_id=1476)\n  * [Taxe de studii](http://admitere.usm.md/)\n    * [Taxele de studii, Ciclul I studii superioare de licenţă](https://admitere.usm.md/?page_id=3740)\n    * [Taxele de studii, Ciclul II studii superioare de masterat](https://admitere.usm.md/?page_id=3741)\n\n* [Comisia de admitere](https://admitere.usm.md/?page_id=1445)\n\n* [Rezultate](https://admitere.usm.md/?page_id=56)\n  * [Turul I: Anunţarea rezultatelor finale](https://admitere.usm.md/?page_id=2682)\n  * [Turul II: Anunţarea rezultatelor finale](https://admitere.usm.md/?page_id=2778)\n\n* [Centrul de Ghidare în Carieră](https://cgc.usm.md/)\n\n* [Ro:](https://admitere.usm.md/?page_id=1925# \"Română\")\n  * [Română](https://admitere.usm.md/?page_id=1925&lang=ro \"Română\")\n  * [English](https://admitere.usm.md/?page_id=1925&lang=en \"English\")\n  * [Русский](https://admitere.usm.md/?page_id=1925&lang=ru \"Русский\")\n[](https://admitere.usm.md/?page_id=1925#)\n\nÎntrebări frecvente\n===================\n\n<br />\n\n**Când începe concursul de admitere la USM?**\n\nÎnscrierea candidaților la concursul de admitere se va realiza prin intermediul sistemului informațional **eAdmitere** , accesând pagina web **eadmitere.gov.md** Perioada exactă a admiterii va fi stabilită de Ministerul Educației și Cercetării și va fi anunțată ulterior. Vă recomandăm să urmăriți pagina oficială a USM pentru informații actualizate.\n\n**Unde pot obține informații despre oferta educațională a facultăților?**\n\n**oferta educațională licență:** **[Specialitati -- Admitere 2025 (usm.md)](https://admitere.usm.md/?page_id=98)**\n\n**oferta educațională master: [Specialitati -- Admitere 2025 (usm.md)](https://admitere.usm.md/?page_id=94)**\n\n**Pot aplica on-line la programele de licență a USM?**\n\nDa, poți aplica online la programele de licență ale USM prin intermediul sistemului informațional eAdmitere, accesând pagina web [eadmitere.gov.md](http://eadmitere.gov.md/). Înscrierea și depunerea actelor se realizează exclusiv online, conform procedurilor stabilite. Vă recomandăm să consultați calendarul admiterii pentru termenele și etapele procesului de admitere\n\n**Unde pot depune dosarul?**\n\nDosarul de admitere se depune exclusiv online, prin intermediul platformei eAdmitere, accesând eadmitere.gov.md. Toate documentele necesare trebuie încărcate în sistem conform instrucțiunilor disponibile pe platformă. Vă recomandăm să consultați calendarul admiterii pentru termenele și etapele procesului.\n\n**Pot să depun dosarul la mai multe programe de studii universitare de licență?**\n\nDa, poți opta pentru maxim 3 specialități/programe de studii în cadrul aceleiași sau a diferitor facultăți, depunând un singur dosar de înscriere. În cererea de înscriere la admitere vei specifica specialitățile/programele de studii solicitate și vei achita o singura taxă de înscriere.\n\n**Ce acte conține dosarul de înscriere?**\n\nDosarul de înscriere la concursul de admitere conține:\n\n**[Acte Licență](https://admitere.usm.md/?page_id=562)**\n\n**[Acte Master](https://admitere.usm.md/?page_id=565)**\n\n**Care sunt condițiile de admitere la facultăți?**\n\nConcursul de admitere pentru deţinătorii diplomelor de bacalaureat, diplomelor de studii medii de specialitate şi diplomelor de studii superioare/licenţă se va efectua în baza următoarei formule de concurs:\n\n**MC = 0,5 MEA+ 0,5 MAS,** unde:\n\n**MC** -- *media de concurs;*\n\n**MEA** -- *nota medie a examenelor de absolvire;*\n\n**MAS** -- *nota medie pentru anii studii.*\n\n**Este posibil să îmi depună altcineva dosarul de concurs?**\n\nDa. Înscrierea unui candidat poate fi făcută de către o altă persoană numai dacă aceasta prezintă o procură autentificată notarial, în care se precizează explicit și împuternicirea respectivei persoane pentru semnarea contractului în numele candidatului.\n\n**Pot fi admis la USM în baza diplomei de absolvire a colegiului?**\n\nDa, se permite admiterea în baza diplomei de colegiu.\n\n**Ce discipline voi studia în decursul anilor de studii la USM?**\n\nConsultați planurile de învățământ accesând fiecare facultate+specialitate:\n\n* **oferta educațională licență: [Specialitati -- Admitere 2025 (usm.md)](https://admitere.usm.md/?page_id=98)**\n\n* **oferta educațională master: ++[Specialitati -- Admitere 2025 (usm.md)](https://admitere.usm.md/?page_id=94)++**\n\n**Am fost admis(ă), ce trebuie să fac pentru confirmarea locului?**\n\nÎn cazul în care ai fost admis(ă) pe locuri finanțate de la bugetul de stat, trebuie să depui actele în original, conform datelor indicate în calendarul admiterii.\n\nÎn cazul în care ai fost admis(ă) pe locuri cu taxă trebuie să depui actele în original, să semnezi contractual de studii, să achiți taxa de școlarizare şi să prezinți bonul de plată (în original sau copie după aceasta) conform datelor prevăzute în contractul de studii și indicate în calendarul admiterii.\n\nÎn cazul nerespectării acestor condiții, în perioada de înmatriculare, **CANDIDATUL** va fi declarat **RESPINS**.\n\n**Care este cuantumul taxei de înscriere?**\n\nCuantumul taxei de înscriere nu a fost încă stabilit. Informațiile actualizate privind taxele și alte detalii legate de admitere vor fi publicate pe site-ul oficial al USM mai aproape de perioada admiterii. Vă recomandăm să verificați periodic platformele oficiale pentru ultimele noutăți.\n\n**Unde achit taxa de înscriere?**\n\nTaxa de înscriere se achită, în momentul depunerii dosarului de concurs, prin intermediul ****terminalelor de plată**** , [****a serviciului Mpay****](https://mpay.gov.md/Services/Service/USM01)\n\n**În ce condiții se returnează taxa de înscriere?**\n\nTaxa de înscriere **nu se returnează**.\n\n**Se acordă scutiri pentru taxa de înscriere la admitere?**\n\nTaxa de inscriere nu va fi perceput de la candidații care aplică la Academia Militar „Alexandru cel Bun\", Academia „Stefan cel Mare\" a MAI, tinerii rămași fară ocrotire printească și acei cu grad accentuat și sever de dizabilitate.\n\n**Care este cuantumul taxei de studii?**\n\nTaxa anuală de studii pentru candidații admiși în regim cu taxă în anul universitar 2025-2026 va fi stabilită și anunțată ulterior. Vă recomandăm să consultați periodic site-ul oficial al USM pentru actualizări.\n\n**Se acordă reduceri la taxa de studii?**\n\nDa. Pot fi acordate următoarele reduceri de taxe pentru **candidații orfani,** proveniți din centre de plasament sau cu situații sociale deosebite:\n\n* reducere la taxa de studii;\n\n* reducere la taxa de cămin;\n\n* abonament lunar pentru troleibuz -- gratuit\n\nCuantumul acestor reduceri, precum și criteriile de acordare a lor se decid de conducerea universității.\n\n**Pot plăti taxa de studii prin transfer bancar?** [Source]{https://admitere.usm.md/?page_id=1925)",
    "Acte necesare la admitere ciclul I -- Admitere 2024 Skip to content  \n[![](https://admitere.usm.md/wp-content/uploads/cropped-cropped-logo_dark_22-2-1.png)](https://admitere.usm.md/)[![Admitere 2024](https://admitere.usm.md/wp-content/uploads/cropped-cropped-logo_dark_22-2.png)](https://admitere.usm.md/)\n\n* [Oferta 2024](http://admitere.usm.md/)\n  * [Licenta](https://admitere.usm.md/?page_id=98)\n  * [Master](https://admitere.usm.md/?page_id=94)\n  * [Întrebări frecvente](https://admitere.usm.md/?page_id=1925)\n  * [Programe de motivare](https://admitere.usm.md/?page_id=2395)\n  * [Broșuri](https://admitere.usm.md/?page_id=41)\n  * [Taxe](https://admitere.usm.md/?page_id=4209)\n\n* [Calendarul admiterii](https://admitere.usm.md/?page_id=3906)\n\n* [Acte](http://admitere.usm.md/)\n  * [Regulamente](https://admitere.usm.md/?page_id=50)\n  * [Acte necesare admitere](http://admitere.usm.md/)\n    * [Acte necesare la admitere ciclul I](https://admitere.usm.md/?page_id=562)\n    * [Acte necesare la admitere ciclul II](https://admitere.usm.md/?page_id=565)\n  * Plan de admitere\n    * [Plan admitere Licenţă cu frecvență](http://admitere.usm.md/wp-content/uploads/Plan-inmatriculare_Licenta-2.pdf)\n    * [Plan admitere Licenţă cu frecvență redusă](http://admitere.usm.md/wp-content/uploads/Plan-inmatriculare_Licenta_frec.-redusa-1.pdf)\n    * [Plan admitere Master cu frecvență](http://admitere.usm.md/wp-content/uploads/Plan-inmatriculare_Master-2.pdf)\n    * [Plan admitere Master cu frecvență redusă](http://admitere.usm.md/wp-content/uploads/Plan-inmatriculare_master.frec_.redusa.pdf)\n    * [Plan admitere pentru studenți străini](http://admitere.usm.md/wp-content/uploads/plan-inmatr.-cetateni-straini-1.pdf)\n  * [Tuition fees](https://admitere.usm.md/?page_id=1476)\n  * [Taxe de studii](http://admitere.usm.md/)\n    * [Taxele de studii, Ciclul I studii superioare de licenţă](https://admitere.usm.md/?page_id=3740)\n    * [Taxele de studii, Ciclul II studii superioare de masterat](https://admitere.usm.md/?page_id=3741)\n\n* [Comisia de admitere](https://admitere.usm.md/?page_id=1445)\n\n* [Rezultate](https://admitere.usm.md/?page_id=56)\n  * [Turul I: Anunţarea rezultatelor finale](https://admitere.usm.md/?page_id=2682)\n  * [Turul II: Anunţarea rezultatelor finale](https://admitere.usm.md/?page_id=2778)\n\n* [Centrul de Ghidare în Carieră](https://cgc.usm.md/)\n\n* Ro: ![Română](https://admitere.usm.md/wp-content/plugins/qtranslate-x/flags/ro.png)\n  * [![Română](https://admitere.usm.md/wp-content/plugins/qtranslate-x/flags/ro.png) Română](https://admitere.usm.md/?page_id=562&lang=ro \"Română\")\n  * [:uk: English](https://admitere.usm.md/?page_id=562&lang=en \"English\")\n  * [:ru: Русский](https://admitere.usm.md/?page_id=562&lang=ru \"Русский\")\n\n[![](https://admitere.usm.md/wp-content/uploads/cropped-cropped-logo_dark_22-2-1.png)](https://admitere.usm.md/)[![Admitere 2024](https://admitere.usm.md/wp-content/uploads/cropped-cropped-logo_dark_22-2.png)](https://admitere.usm.md/)\n\n* [Oferta 2024](http://admitere.usm.md/)\n  * [Licenta](https://admitere.usm.md/?page_id=98)\n  * [Master](https://admitere.usm.md/?page_id=94)\n  * [Întrebări frecvente](https://admitere.usm.md/?page_id=1925)\n  * [Programe de motivare](https://admitere.usm.md/?page_id=2395)\n  * [Broșuri](https://admitere.usm.md/?page_id=41)\n  * [Taxe](https://admitere.usm.md/?page_id=4209)\n\n* [Calendarul admiterii](https://admitere.usm.md/?page_id=3906)\n\n* [Acte](http://admitere.usm.md/)\n  * [Regulamente](https://admitere.usm.md/?page_id=50)\n  * [Acte necesare admitere](http://admitere.usm.md/)\n    * [Acte necesare la admitere ciclul I](https://admitere.usm.md/?page_id=562)\n    * [Acte necesare la admitere ciclul II](https://admitere.usm.md/?page_id=565)\n  * Plan de admitere\n    * [Plan admitere Licenţă cu frecvență](http://admitere.usm.md/wp-content/uploads/Plan-inmatriculare_Licenta-2.pdf)\n    * [Plan admitere Licenţă cu frecvență redusă](http://admitere.usm.md/wp-content/uploads/Plan-inmatriculare_Licenta_frec.-redusa-1.pdf)\n    * [Plan admitere Master cu frecvență](http://admitere.usm.md/wp-content/uploads/Plan-inmatriculare_Master-2.pdf)\n    * [Plan admitere Master cu frecvență redusă](http://admitere.usm.md/wp-content/uploads/Plan-inmatriculare_master.frec_.redusa.pdf)\n    * [Plan admitere pentru studenți străini](http://admitere.usm.md/wp-content/uploads/plan-inmatr.-cetateni-straini-1.pdf)\n  * [Tuition fees](https://admitere.usm.md/?page_id=1476)\n  * [Taxe de studii](http://admitere.usm.md/)\n    * [Taxele de studii, Ciclul I studii superioare de licenţă](https://admitere.usm.md/?page_id=3740)\n    * [Taxele de studii, Ciclul II studii superioare de masterat](https://admitere.usm.md/?page_id=3741)\n\n* [Comisia de admitere](https://admitere.usm.md/?page_id=1445)\n\n* [Rezultate](https://admitere.usm.md/?page_id=56)\n  * [Turul I: Anunţarea rezultatelor finale](https://admitere.usm.md/?page_id=2682)\n  * [Turul II: Anunţarea rezultatelor finale](https://admitere.usm.md/?page_id=2778)\n\n* [Centrul de Ghidare în Carieră](https://cgc.usm.md/)\n\n* Ro: ![Română](https://admitere.usm.md/wp-content/plugins/qtranslate-x/flags/ro.png)\n  * [![Română](https://admitere.usm.md/wp-content/plugins/qtranslate-x/flags/ro.png) Română](https://admitere.usm.md/?page_id=562&lang=ro \"Română\")\n  * [:uk: English](https://admitere.usm.md/?page_id=562&lang=en \"English\")\n\n* [:ru: Русский](https://admitere.usm.md/?page_id=562&lang=ru \"Русский\")\n\nActe necesare la admitere ciclul I\n==================================\n\n<br />\n\n***Documente obligatorii:***\n\n* cererea de înscriere la concursul de admitere;\n\n* actul de studii, în original, cu anexa respectivă (absolvenți liceelor din România și alte state, promoția din anul admiterii, prezintă certificatul de studii, cu notele obținute la examenele de bacalaureat şi situația școlară pe anii de studii, urmând ca diploma de bacalaureat să fie prezentată ulterior); act de studii-xerox\n\n* 4 fotografii 3×4 cm;\n\n* copia buletinului de identitate;\n\n* Adeverință de recrut\n\n***Alte documente, în situații speciale:***\n\n* diplomele de gradul I-III, obținute de către candidați la concursurile școlare republicane sau internaționale, la disciplinele de studiu, precum și diplomele ce atestă participarea la diferite concursuri (olimpiade), expoziții etc., organizate de Ministerul Educației, Culturii și Cercetării sau de ministerele de resort; [Source]{https://admitere.usm.md/?page_id=562)"
  ],
  "question": "Când începe concursul de admitere la USM?",
  "groundTruth": "Înscrierea candidaților la concursul de admitere se va realiza prin intermediul sistemului informațional eAdmitere, accesând pagina web eadmitere.gov.md  Perioada exactă a admiterii va fi stabilită de Ministerul Educației și Cercetării și va fi anunțată ulterior. Vă recomandăm să urmăriți pagina oficială a USM pentru informații actualizate."
}